{
  "run_id": "run_quality_20260807_043321",
  "agent_id": "quality",
  "started_at": "2026-08-07T04:33:21Z",
  "finished_at": "2026-08-07T04:33:23Z",
  "dry_run": false,
  "status": "ok",
  "task_id": "task_quality_daily_scan",
  "provider_used": null,
  "model_used": null,
  "counters": {
    "llm_calls": 0,
    "tokens_in_est": 0,
    "tokens_out_est": 0,
    "proposals_generated": 3,
    "proposals_written": 3,
    "proposals_deduplicated": 0,
    "proposals_rejected_auto": 0
  },
  "notes": [
    "qualité: 15/18 OK, 0 nouvelle(s) anomalie(s)"
  ]
}
