{
  "run_id": "run_ux-ai_20260711_003310",
  "agent_id": "ux-ai",
  "started_at": "2026-07-11T00:33:10Z",
  "finished_at": "2026-07-11T00:33:11Z",
  "dry_run": true,
  "status": "ok",
  "task_id": "task_ux_navigation_audit",
  "provider_used": null,
  "model_used": null,
  "counters": {
    "llm_calls": 0,
    "tokens_in_est": 0,
    "tokens_out_est": 0,
    "proposals_generated": 1,
    "proposals_written": 1,
    "proposals_deduplicated": 0,
    "proposals_rejected_auto": 0
  },
  "notes": [
    "ux: 0 page(s) orpheline(s) sur 46",
    "ux: exemple (mock)"
  ]
}
