{
  "run_id": "run_knowledge-builder_20260824_133808",
  "agent_id": "knowledge-builder",
  "started_at": "2026-08-24T13:38:08Z",
  "finished_at": "2026-08-24T13:38:13Z",
  "dry_run": false,
  "status": "no_work",
  "task_id": null,
  "provider_used": "gemini",
  "model_used": "gemini-3.1-flash-lite",
  "counters": {
    "llm_calls": 6,
    "tokens_in_est": 1803,
    "tokens_out_est": 268,
    "proposals_generated": 0,
    "proposals_written": 0,
    "proposals_deduplicated": 0,
    "proposals_rejected_auto": 0
  },
  "notes": [
    "knowledge-builder: +11 relation(s), +0 explication(s) sur 3 sujet(s)"
  ]
}
