{
  "run_id": "run_coverage-gaps_20260727_151801",
  "agent_id": "coverage-gaps",
  "started_at": "2026-07-27T15:18:01Z",
  "finished_at": "2026-07-27T15:18:01Z",
  "dry_run": false,
  "status": "ok",
  "task_id": null,
  "provider_used": null,
  "model_used": null,
  "counters": {
    "llm_calls": 0,
    "tokens_in_est": 0,
    "tokens_out_est": 0,
    "proposals_generated": 3,
    "proposals_written": 3,
    "proposals_deduplicated": 0,
    "proposals_rejected_auto": 0
  },
  "notes": [
    "coverage-gaps: 3 trou(s) sur données structurées (aucune interprétation PDF)"
  ]
}
