{
  "run_id": "run_inspector-evaluator_20260809_023155",
  "agent_id": "inspector-evaluator",
  "started_at": "2026-08-09T02:31:55Z",
  "finished_at": "2026-08-09T02:31:55Z",
  "dry_run": false,
  "status": "no_work",
  "task_id": null,
  "provider_used": null,
  "model_used": null,
  "counters": {
    "llm_calls": 0,
    "tokens_in_est": 0,
    "tokens_out_est": 0,
    "proposals_generated": 0,
    "proposals_written": 0,
    "proposals_deduplicated": 0,
    "proposals_rejected_auto": 0
  },
  "notes": [
    "inspector-evaluator: banc 6 tests, score global 0.97, 1 tâche(s) corrective(s)"
  ]
}
