{
  "run_id": "run_adversarial-tests_20260714_065708",
  "agent_id": "adversarial-tests",
  "started_at": "2026-07-14T06:57:08Z",
  "finished_at": "2026-07-14T06:57:09Z",
  "dry_run": false,
  "status": "no_work",
  "task_id": null,
  "provider_used": null,
  "model_used": null,
  "counters": {
    "llm_calls": 0,
    "tokens_in_est": 0,
    "tokens_out_est": 0,
    "proposals_generated": 0,
    "proposals_written": 0,
    "proposals_deduplicated": 0,
    "proposals_rejected_auto": 0
  },
  "notes": [
    "tests: métriques=ok régressions=0"
  ]
}
